{
    "$schema": "https://json-schema.org/draft/2020-12/schema",
    "$id": "https://graphghan.milo.cat/schema/rows.schema.json",
    "title": "Graphghan written-rows document, schema 1",
    "description": "A piece worked from written rows, not a grid. See docs/chart-format.md §Written-rows document.",
    "type": "object",
    "required": ["schema", "id", "piece", "rows"],
    "properties": {
        "schema": {"const": 1},
        "id": {"type": "string", "pattern": "^sha256:[0-9a-f]{64}$"},
        "piece": {"type": "object", "required": ["title"], "properties": {"title": {"type": "string"}}},
        "palette": {
            "type": "array",
            "items": {
                "type": "object",
                "required": ["code", "name", "hex"],
                "properties": {
                    "code": {"type": "string", "pattern": "^[A-Za-z]{1,3}$"},
                    "name": {"type": "string"},
                    "hex": {"type": "string", "pattern": "^#[0-9A-Fa-f]{6}$"}
                }
            }
        },
        "rows": {
            "type": "array",
            "minItems": 1,
            "items": {
                "type": "object",
                "required": ["label", "from", "text"],
                "properties": {
                    "label": {"type": "string"},
                    "from": {"type": "integer", "minimum": 1},
                    "to": {"type": "integer", "minimum": 1},
                    "text": {"type": "string"},
                    "count": {"type": "integer", "minimum": 1},
                    "code": {"type": "string", "pattern": "^[A-Za-z]{1,3}$"},
                    "repeat": {"type": "string", "minLength": 1}
                }
            }
        },
        "source": {
            "type": "object",
            "properties": {"pages": {"type": "array", "items": {"type": "integer", "minimum": 1}}}
        },
        "notes": {
            "type": "array",
            "items": {
                "type": "object",
                "required": ["title", "text"],
                "properties": {"title": {"type": "string"}, "text": {"type": "string"}}
            }
        }
    }
}
