{"id":"sha256:bc32330e706d86bc6ee381e4414a6b60df4b2cff6786845750f6a03c7e2334ca","palette":[{"code":"A","hex":"#201b18","name":"black"}],"piece":{"title":"Strap"},"rows":[{"code":"A","count":6,"from":1,"label":"R 1","text":"(Black) ch 7, 6 sc [6]","to":1},{"count":6,"from":2,"label":"R 2 - R 10","text":"ch 1, turn, 6 sc [6]","to":10}],"schema":1,"source":{"pages":[3]}}
