{
  "schema": 1,
  "id": "sha256:191bb826ce837e67a89a7b0250b1e390ef361cfa116c771c4db5bd4ad8dc7269",
  "piece": {
    "title": "Strip"
  },
  "palette": [
    {
      "code": "A",
      "name": "Color A",
      "hex": "#112233"
    },
    {
      "code": "B",
      "name": "Color B",
      "hex": "#ffffff"
    }
  ],
  "rows": [
    {
      "label": "R 1",
      "from": 1,
      "to": 1,
      "code": "A",
      "count": 6,
      "text": "(A) ch 7, from the hook’s second chain, 6 sc [6]"
    },
    {
      "label": "R 2 - R 4",
      "from": 2,
      "to": 4,
      "count": 6,
      "text": "ch 1, turn, 6 sc [6]"
    },
    {
      "label": "R 5",
      "from": 5,
      "to": 5,
      "code": "B",
      "count": 6,
      "text": "(B) ch 1, turn, 6 sc [6]"
    }
  ],
  "source": {
    "pages": [
      3
    ]
  }
}
